{
  "yard": "y-1a2b3c4d",
  "owner": "usr_aaron",
  "display_name": "Aaron's yard",
  "visibility": "summary",
  "capabilities": [
    {
      "id": "device-test-ios",
      "description": "Run the iOS device suite",
      "approval": "ask_owner",
      "accept_from": ["y-1a2b3c4d"],
      "accept_when_offline": false,
      "open": false
    }
  ],
  "direct_lines": "never",
  "hold_minutes": 1,
  "release_minutes": 43200
}
